{
 "title": "Pathwell Harada Chart",
 "lede": "A source-checked, recursively navigable thematic argument, not a verdict imposed on the novel. The central wording is a working interpretation of the author’s controlling idea; every child explains how the story tests it, including counterexamples and irreparable costs.",
 "footer": "Working thematic revision grounded in canonical Chapters 1–18, the author’s Thesis-and-Controlling-Ideas, Non-Negotiable Scenes, Writing Principles and revision decisions. All chapter quotes must match manuscript text; interpretive claims and proposals remain distinct from canon.",
 "labels": {
  "center": "Proposed controlling message",
  "centerNote": "How the whole story argues this",
  "source": "Ch",
  "sourceName": "Chapter"
 },
 "root": {
  "title": "Control is not competence; others pay when you decide for them.",
  "ch": 18,
  "quote": "Are you ready?",
  "note": "WORKING THEMATIC CENTRE, not yet author-approved wording. This is grounded in the authoritative Thesis-and-Controlling-Ideas: Pathwell confuses the power to intervene and pay with the right to determine another person's life; the magic literally consumes human histories and possible futures. Elizabeth acts without magic, accepts loss and eventually makes an invitation rather than taking charge of Pathwell's answer. Shade's refusal is valid even though a cleanup creature kills him anyway; consent is not a guarantee of survival. Stansbury and Camp offer qualified counterexamples, and Pathwell's delayed confession/restitution change his conduct without restoring Shade or earning automatic pardon. The opening and closing 'Ready? / No. / Perfect.' exchange changes from overridden objection to chosen, mutually accepted movement; it does not erase the difference between being unready and unwilling. These are tested readings of Chapters 1, 3–4, 7–18, not a moral uttered by the characters.",
  "kids": [
   {
    "title": "Elizabeth becomes the author of her own decisions",
    "kind": "character",
    "note": "She resists from Chapter 1, but her objections do not determine what happens while others control the facts, danger and her property. Her agency grows through particular imperfect and costly decisions—forest, cookbook, car, accusation, diary, rescue—and ends in an invitation that leaves Pathwell free to answer. Her significance never depends on a magical gift, being a chosen target or guaranteeing a perfect outcome.",
    "kids": [
     {
      "title": "Start: Elizabeth resists before anyone listens",
      "note": "The first chapter does not show a woman who simply complies. She objects to a stranger reading her diary, asks questions, takes back the cookbook, says she will not go and answers 'No' to being ready. The danger, withheld information and Pathwell's physical hand nevertheless determine the departure. Her later arc is from resistance with little effective control toward informed self-direction, not from a total absence of will.",
      "kids": [
       {
        "title": "Three weeks in, nothing unpacked",
        "ch": 2,
        "quote": "Three weeks. Twenty-one days of unpacked boxes and takeout trying to figure out what came next.",
        "status": "paid",
        "note": "A new life she hasn't moved into yet.",
        "kids": [],
        "id": "p1-1-1"
       },
       {
        "title": "She left because staying felt worse",
        "ch": 2,
        "quote": "A life she'd packed into garbage bags and moved across the city because staying felt worse than leaving, but leaving didn't feel like anything at all.",
        "status": "paid",
        "note": "Her real problem, said once, in her own breakdown.",
        "kids": [],
        "id": "p1-1-2"
       },
       {
        "title": "Nobody at work has noticed her",
        "ch": 1,
        "quote": "He'd laughed at her joke about the landlord, which was more than anyone from work had managed.",
        "status": "paid",
        "note": "The stranger going through her boxes is the one person at her party who laughed.",
        "kids": [],
        "id": "p1-1-3"
       },
       {
        "title": "Her polite objection still marks a boundary",
        "ch": 1,
        "quote": "She watched for a moment before interrupting. \"Do you mind?\"",
        "status": "author",
        "note": "She says 'Do you mind?' to a stranger reading her diary. This is restrained and socially polite, not an apology for existing or proof she consents. The proposed sharper line is not in the manuscript; test reader comprehension before replacing her voice. The author retains the decision.",
        "kids": [],
        "id": "p1-1-4"
       },
       {
        "title": "Her worries stay ordinary",
        "ch": 2,
        "quote": "My landlord is going to kill me. How am I going to explain the door?",
        "status": "paid",
        "note": "The meeting, the dry cleaning, the landlord. Her life is still the one she knows.",
        "kids": [],
        "id": "p1-1-5"
       },
       {
        "title": "Polite even when she's hurting",
        "ch": 4,
        "quote": "You're being awfully polite about it.",
        "status": "paid",
        "note": "Mama Baga names the habit on her first night at Camp.",
        "kids": [],
        "id": "p1-1-6"
       }
      ],
      "id": "p1-1"
     },
     {
      "title": "Wants: her books back, then the truth",
      "note": "What she's after changes as she climbs. Each want is a little more her own than the one before.",
      "kids": [
       {
        "title": "Nana's cookbook back",
        "ch": 2,
        "quote": "He still has it.",
        "status": "paid",
        "note": "Ch2–3. Property, not trust.",
        "kids": [],
        "id": "p1-2-1"
       },
       {
        "title": "Answers before she goes anywhere",
        "ch": 3,
        "quote": "I'm not going anywhere without getting some questions answered.",
        "status": "paid",
        "kids": [],
        "id": "p1-2-2"
       },
       {
        "title": "To know why it came to her door",
        "ch": 4,
        "quote": "She wanted to know why something impossible had come through her door before the magic went wrong.",
        "status": "paid",
        "note": "The first want that isn't about getting something back.",
        "kids": [],
        "id": "p1-2-3"
       },
       {
        "title": "To be let into her own story",
        "ch": 7,
        "quote": "But somehow every time we get to the part where somebody explains what the hell is happening, I become the driver.",
        "status": "paid",
        "kids": [],
        "id": "p1-2-4"
       },
       {
        "title": "For him to say what he did",
        "ch": 10,
        "quote": "But you still chose it.",
        "status": "paid",
        "kids": [],
        "id": "p1-2-5"
       },
       {
        "title": "To keep the world she's found",
        "ch": 9,
        "quote": "So I'm leverage.",
        "status": "paid",
        "note": "R40: her fear after the diner is losing this world, not losing her status.",
        "kids": [],
        "id": "p1-2-6"
       }
      ],
      "id": "p1-2"
     },
     {
      "title": "Needs: to direct herself without controlling everyone else",
      "note": "She already resists, so the unmet need is not to discover she can say no; it is to obtain enough truth, set terms, act despite uncertainty and own the consequences. Her best choices involve limits: she cannot rescue everyone or recover destroyed originals.",
      "kids": [
       {
        "title": "Nobody is going to make her important",
        "ch": 9,
        "quote": "Then you were never the point.",
        "status": "paid",
        "note": "The diner takes away the importance Pathwell gave her by mistake.",
        "kids": [],
        "id": "p1-3-1"
       },
       {
        "title": "She has to make herself the driver",
        "ch": 8,
        "quote": "Elizabeth chose the ditch.",
        "status": "paid",
        "kids": [],
        "id": "p1-3-2"
       },
       {
        "title": "She has to say no and mean it",
        "ch": 11,
        "quote": "I don't need to be rescued.",
        "status": "paid",
        "kids": [],
        "id": "p1-3-3"
       },
       {
        "title": "She has to let go of what she's holding",
        "ch": 12,
        "quote": "\"No,\" she said. \"Give.\"",
        "status": "paid",
        "kids": [],
        "id": "p1-3-4"
       }
      ],
      "id": "p1-3"
     },
     {
      "title": "Stands for: human worth without magical exceptionalism",
      "note": "She owns ordinary decisions and acts with an injured body, not an undiscovered magical power. The dagger is Stansbury's enchantment; the Camp fire rescue works without it. She matters neither because she was the blob's target nor because her choice causes a magically favorable outcome.",
      "kids": [
       {
        "title": "She never does magic",
        "status": "paid",
        "note": "Canon hard boundary. She can own, carry, give, or position charged things. She can't use them.",
        "kids": [],
        "id": "p1-4-1"
       },
       {
        "title": "Ordinary people feel the magic too",
        "ch": 3,
        "quote": "None of that had been hers, and she held on to that.",
        "status": "paid",
        "note": "Her overwhelm in the Space Between isn't a hidden gift.",
        "kids": [],
        "id": "p1-4-2"
       },
       {
        "title": "The dagger is Stansbury's magic, her choice",
        "ch": 7,
        "quote": "Elizabeth already had the dagger in her hand.",
        "status": "paid",
        "kids": [],
        "id": "p1-4-3"
       },
       {
        "title": "Her diary burns without being used",
        "ch": 15,
        "quote": "No spell.",
        "status": "paid",
        "note": "“No sacrifice. No last message.”",
        "kids": [],
        "id": "p1-4-4"
       },
       {
        "title": "Her strength is physical and stupid",
        "ch": 15,